{
  "name": "Keller",
  "slug": "keller",
  "geographic_type": "city",
  "city": null,
  "county": null,
  "coordinates": null,
  "school_district": null,
  "major_road_access": null,
  "employment_relationships": null,
  "housing_mix": null,
  "new_construction_status": null,
  "major_builders": null,
  "price_band": null,
  "tax_rate": null,
  "MUD": null,
  "PID": null,
  "HOA": null,
  "commute_estimates": null,
  "source": null,
  "verified_date": null,
  "notes": "Stub record created 2026-08-24 to establish the schema. All null fields are unknown-by-policy: populate only from verified sources per northfwliving-data/PROVENANCE.md.",
  "history": []
}
